{
  "schema_id": "obliteratus.trusted-worker-message",
  "schema_version": "1.0.0",
  "message_type": "complete",
  "sequence": 4,
  "source_inventory_digest": "sha256:aaaaaaaaaaaaaaaaaaaaaaaaaaaaaaaaaaaaaaaaaaaaaaaaaaaaaaaaaaaaaaaa",
  "adapter_digest": "sha256:bbbbbbbbbbbbbbbbbbbbbbbbbbbbbbbbbbbbbbbbbbbbbbbbbbbbbbbbbbbbbbbb",
  "policy_digest": "sha256:cccccccccccccccccccccccccccccccccccccccccccccccccccccccccccccccc",
  "payload": {"record_count": 4, "encoded_bytes": 4096, "transcript_digest": "sha256:dddddddddddddddddddddddddddddddddddddddddddddddddddddddddddddddd"}
}
